{
  "schemaVersion": 1,
  "identity": {
    "id": "fixture-1",
    "name": "Fixture",
    "personality": "cute",
    "seed": 12345,
    "baseModel": "lulu"
  },
  "progression": {
    "phase": "teen",
    "level": 3,
    "xp": 50,
    "energy": 70,
    "health": 85
  },
  "state": {
    "mood": "neutral",
    "animation": { "primary": "idle", "speed": 1 },
    "reduceMotion": false,
    "lastSeenAt": "2026-05-23T10:00:00Z"
  },
  "dna": {
    "empathy": 0.6,
    "curiosity": 0.4,
    "creativity": 0.5,
    "discipline": 0.5,
    "chaos": 0.2,
    "aggression": 0.1,
    "resilience": 0.7,
    "emotionalDepth": 0.5,
    "socialEnergy": 0.6,
    "adaptability": 0.5,
    "intelligence": 0.55
  },
  "visuals": {
    "bodyTint": 16777215,
    "accentTint": 16738740,
    "glowTint": 6750207,
    "emissiveIntensity": 0.15,
    "roughness": 0.55,
    "metalness": 0.05,
    "clearcoat": 0,
    "pattern": "plain",
    "phaseScale": 0.95
  },
  "morphology": {
    "boneScales": {
      "head": 1.05,
      "neck": 1,
      "body": 1,
      "arm_L": 1,
      "arm_R": 1,
      "leg_L": 1,
      "leg_R": 1,
      "eye_L": 1.1,
      "eye_R": 1.1,
      "jaw": 1
    },
    "limbCount": 4,
    "eyeSize": 1.1,
    "hasTail": false,
    "hasSpikes": false,
    "pattern": "plain"
  },
  "accessories": [],
  "mutations": [],
  "environment": {
    "sceneId": "mascot_room",
    "tint": "#E8F0FF",
    "quality": "medium"
  }
}
